stem_ing;continent
for cake , packag white cake mix with pud , veget oil , egg white , water , bittersweet chocol , fine , for fill , cold heavi whip cream , confection sugar , frozen unsweeten raspberri , chocolateco toffe bit , fine toast hazelnut , skin remov , for ganach , heavi cream , semisweet chocol , , for frost , packag white chocol chip , unsalt butter , at room temperatur , packag cream chees , soften , vanilla extract , food color , if desir option; european
packet dri au ju mix , thinli slice roast beef , garlic powdertast , saltpeppertast , jar roast red bell pepper , drainedsl , slice extra sharp provolon chees , torpedo roll , split; european
yellow curri past , chicken broth , divid , white sugar , curri powder , salt , light soy sauc , coconut milk , ola oil , skinless , boneless chicken breast halv , slice , minc garlic , minc fresh ginger , onion , slice , potato peel , halv , slice; asian
allpurpos flour , bake powder , salt , lard , white sugar , anis seed , egg , brandi , white sugar , ground cinnamon; latin american
lean ground beef , packag dri onion soup mix , dri oregano , whole peel tomato , undrain , water , macaroni , grate parmesan chees , shred mozzarella chees; european
quart ice cube , fluid frozen limead concentr , fluid tequila measur with empti limead , cointreau , garnish , margaritakosh salt for the rim , lime slice; latin american
semisweet chocol chip , heavi cream , white sugar , pinch salt , vanilla extract , egg yolk , white sugar; european
water , dri couscou , oliv oil , small white onion , , green bell pepper , , clove garlic , minc , marin artichok heart , liquid reserv , caper , liquid reserv , small green oliv , stew tomato , drain , white wine option , lemon juic , water , sumac powder , crush red pepper flake , dri basil , cumin , minc fresh ginger root , ground black peppertast , tilapia fillet , into chunk; middle eastern
mahi mahi fillet , dark rum , fresh lime juic , onion , slice into thin ring , lemon , slice , dri oregano , butter , ground black peppertast; latin american
allpurpos flour , white sugar , salt , bake powder , butter , egg , beaten , cream , larg appl peel , coredthinli slice , struesel top , cold butter , brown sugar , flour , ground cinnamon; european
cube seed watermelon , water , white sugar , to tast , slice lime , fresh mint leav , ice; latin american
allpurpos flour , bake powder , butter , soften , white sugar , egg , lemon zest , almond extract , toast almond , fine , egg white; european
skinless , boneless chicken breast , italianstyl salad dress , italianstyl dri bread crumb; european
curri powder , divid , garlic powder , season salt , onion powder , salt , sprig fresh thyme , leav strip , pinch ground allspic , moretast , saltground black peppertast , whole chicken , into piec , veget oil , water , potato , dice , carrot , scallion green onion , , inch piec fresh ginger root , minc , scotch bonnet chile pepper , , to tast; latin american
eye of round , thinli slice , lime juic , honey , veget oil , toast sesam seed , reducedsodium soy sauc , sesam oil , fine fresh ginger root , leav red leaf lettuc rins , driedtorn , inch flour tortilla; asian
dri thaistyl rice noodl , wide such as chantaboon rice noodl , oliv oil , clove garlic , minc , thick soy sauc , white sugar , oliv oil , clove garlic , minc , pork ani , thinli slice , serrano pepper , minc , moretast , fresh basil leav , , thick soy sauc , white sugar , salt , bean sprout; asian
skinless , boneless chicken breast halv , onion , , light sour cream , shred reducedfat cheddar chees , dri parsley , dri oregano , ground black pepper , salt option , tomato sauc , water , chili powder , green bell pepper , red bell pepper , clove garlic , minc , black bean , rinseddrain , inch whole wheat flour tortilla , jar taco sauc , shred reducedfat cheddar chees; latin american
extravirgin oliv oil , ground cumin , kosher salt , dri oregano , minc garlic , lime juic , orang juic , whole chicken , into piec; latin american
coconut milk , green curri past , chicken broth , slice water chestnut , drain , slice bamboo shoot , drain , green bell pepper , into inch piec , slice fresh mushroom , boneless skinless chicken breast , into inch piec , fish sauc , fresh basil; asian
pie fill , egg , white sugar , vanilla extract , ricotta chees , miniatur semisweet chocol chip , tooption , sweet crust , allpurpos flour , bake powder , white sugar , shorten , chill , shorten , chill , egg , lightli beaten , vanilla extract , milk option; european
boneless beef chuck roast , packet taco season mix , jar green salsa , beef broth , more if need; latin american
oliv oil , clove garlic , crush , packag fresh mushroom , slice , bunch fresh asparagu , trim , pure tomato , saltpeppertast , packag uncook penn pasta , heavi cream; european
refriger dinner roll dough , lean ground beef , pork sausag , shred cabbag , onion , salt , butter , melt; european
oliv oil , sweet italian sausag , slice , boneless , skinless chicken breast , cube , medium onion , , medium green bell pepper , , cube chicken bouillon , hot water , salt , ground thyme , garlic powder , frozen green pea , instant rice , medium tomato , dice; european
wholemilk greek yogurt , freshli squeez lemon juic , moretast , oliv oil , ketchup , clove garlic , minc , aleppo red pepper flake , kosher salt , ground cumin , freshli ground black pepper , paprika , ground cinnamon , boneless , skinless chicken thigh , halv , long metal skewer; middle eastern
cherri tomato such as sun gold , oliv oil , clove garlic , slice , saltground black peppertast , chicken broth , fresh oregano leav , red pepper flake , penn pasta , grate parmigianoreggiano chees; european
larg eggplant , slice into inch round , larg potato , thinli slice , larg zucchini , lengthwis into inch slice , extravirgin oliv oil , butter , allpurpos flour , milk , pinch ground nutmeg , salttast , egg yolk , beaten , oliv oil , ground beef , onion , , oregano , saltpeppertast , fresh parsley , ripe tomato , , crumbl feta chees; european
packag refriger pizza crust dough , jar spaghetti sauc , cook ham , slice , capacola sausag , slice , salami , slice , pepperoni sausag , slice , garlic powdertast , mozzarella chees , shred , onion , slice , mushroom , slice , green bell pepper , slice; european
packag penn pasta , oliv oil , onion , , cook chicken , italianstyl dice tomato , packag spinach , packag cream chees , soften , shred mozzarella chees; european
packag frozen spinach , crumbl feta chees , shred mozzarella chees , cube process chees food , melt butter , divid , distil white vinegar , garlic powder , saltpeppertast , packag phyllo dough; european
whole chicken , skin remov , lemon , , clove peel garlic , moretast divid , red potato , slice into inch thick round , larg onion , roughli , white wine , oliv oil , chicken bouillon granul , boil water , dri oregano , saltpeppertast; european
veget oil , dice chicken meat , salt , ground black pepper , chicken broth , soy sauc , celeri , bamboo shoot , drainedd , water chestnut , drainedd , cornstarch , cold water , cashew; asian
veget oil , onion , , clove garlic , water , tomato , larg green bell pepper , salt , garam masala , chili powder , heavi cream , butter , skinless , boneless chicken breast halv into bites piec; asian
dri fettuccin pasta , oliv oil , evapor skim milk , grate parmesan chees , dri basil , lemon , juic , pinch ground black pepper; european
malt vinegar , plain yogurt , veget oil , saltpeppertast , mix spice , freshli ground cardamom , skinless , boneless chicken thigh , tahini , plain yogurt , minc garlic , lemon juic , oliv oil , fresh parsley , saltpeppertast , medium tomato , thinli slice , slice onion , shred lettuc , pita bread round; middle eastern
green bell pepper , seed , small white onion , , clove garlic , crush , ground cumin , salt , divid , oliv oil , oliv oil , achiot powder , ground cumin , tomato sauc , beef stew meat , into inch cube , white potato , white wine , water , cube beef bouillon; latin american
skinless , boneless chicken breast halv ed inch thick , garlic salttast , ground black peppertast , thinli slice ham , slice swiss chees , slice bacon , chicken broth; european
chili powder , ground cumin , ground paprika , salt , garlic powder , onion powder , dri oregano , cayenn pepper , packag ground turkey , water , cider vinegar , brown sugar; latin american
link hot italian sausag , larg onion , , red bell pepper , seededd , green bell pepper , seededd , mushroom , drain , packag penn pasta , italian salad dress , grate parmesan chees for top; european
chicken broth , butter , onion , , pearl barley , dri thyme , bay leaf , oliv oil , mushroom , slice , garlic , , fresh parsley; european
coconut milk , red thai curri past , fish sauc , fresh red chili pepper , seededminc , larg shrimp , peeleddevein; asian
lean steak , into strip , fresh lime juic , ground black pepper , fresh cilantro , veget oil , larg onion , into thin strip , julien green bell pepper , lemon , quarter , saltpeppertast , inch flour tortilla; latin american
pork tenderloin , crosswis into slice , lime , zestedju , oliv oil , ground cumin , salt , pinch crush red pepper flake option , clove garlic , press; latin american
ghee clarifi butter , bulb garlic , peeledminc , toast cumin seed , tomato past , inch piec ginger , peeledminc , garam masala , salt , larg onion , fine , water , as need , box frozen spinach , thaweddrain , paneer , into inch cube , fresh cilantro , garam masala; asian
inch corn tortilla , unpeel butternut squash , seed , water , oliv oil , clove garlic , minc , onion , , fresh spinach , sundri tomato , , enchilada sauc , crumbl goat chees , crumbl cotija chees , cilantro leav , for garnish option , sour cream , for top option; latin american
mayonnais , flake coconut , fine , fresh mint , ground chicken , panko bread crumb , thai peanut sauc , red curri past , minc green onion , minc fresh parsley , soy sauc , clove garlic , minc , lemon juic , lime juic , hot pepper sauc , hamburg bun , splittoast; asian
almond past , butter , soften , white sugar , egg , almond extract , allpurpos flour , salt , drop green food color , drop yellow food color , drop red food color , jar seedless raspberri jam , heat , packag semisweet chocol chip , melt; european
condens cream of mushroom soup , milk , onion , prepar mustard , sauerkraut , rinsedsqueez dri , packag egg noodl , kielbasa polish sausag , into inch piec , shred swiss chees , whole wheat bread crumb , butter , melt; european
oliv oil , larg onion , dice , gingergarl past , larg tomato , dice , cayenn pepper , moretast , curri powder , garam masala , ground turmer , ground cumin , skinless , boneless chicken breast halv into bites piec , larg redskin potato , , fresh cilantro; asian
orang peko tea bag , boil water , ice cube , sweeten condens milk , honey; asian
vinegar , clove garlic , fresh ginger , salt , cayenn pepper , ground coriand , ground cumin , veget oil , thick catfish fillet , into larg chunk; asian
veget oil , onion , thinli slice , ground cumin , basmati rice , water , salt , garam masala , frozen mix veget; asian
spaghetti , butter , salt , grate parmesan chees , dri oregano; european
lean ground turkey , fine onion , water chestnut , green bell pepper option , clove garlic , minc , dri parsley , soy sauc , cold water , minc fresh ginger root , salt , ground black pepper; asian
larg unpeel purpl eggplant , trim into inch thick slice , fine sea salt , as need , egg , whole milk , italianseason bread crumb , more as need , extravirgin oliv oil , as need , jar prepar marinara sauc such as de cecco , bunch fresh basil , coars , packag smoke mozzarella chees , veri thinli slice , freshli grate parmesan chees; european
round steak , into bite size piec , garlic powder , ground cumin , saltpeppertast , oliv oil , allpurpos flour , water , onion , slice , green bell pepper ,; latin american
butter , skinless , boneless chicken breast halv into inch cube , condens cream of chicken soup , contain sour cream , green chili , packag ranch dress mix , inch flour tortilla , shred mexi chees blend; latin american
italianseason bread crumb , grate parmesan chees , pinch red pepper flake , to tast , eggplant trim , peel , slice inch thick , oliv oil , tomato past , water , dri basil , dri oregano , dri parsley , clove garlic , crush , brown sugar , sea saltground black peppertast , packag fresh mozzarella chees , slice , grate parmesan chees; european
great northern bean , drainedrins , dice tomato , clove garlic , nutrit yeast , ground cumin , chili powder , salttast , pinch cayenn pepper , to tast , black bean , drainedrins , dice tomato , oliv oil , as need , whole grain tortilla , cook spray; latin american
uncook shortgrain white rice , water , rice vinegar , white sugar , imit crabmeat , fine , mayonnais , sheet nori dri seawe , sesam seed , cucumb , into thin spear , avocado pit , peel , slice the long way; asian
spaghetti sauc , veget oil , bulk pork sausag , zucchini , quarteredsl , ricotta chees , egg white , shred mozzarella chees , grate parmesan chees , noboil lasagna noodl , more if need , spaghetti sauc , divid , grate parmesan chees; european
clove garlic , roughli , fresh oregano , fresh basil , fresh parsley , fresh rosemari , kosher salt , oliv oil , balsam vinegar , white pepper , boneless beef ribey steak , inch thick; european
ground chicken , packag guacamol season mix , fresh cilantro , divid , lime , juic , minc onion , slice ciabatta bread , prepar salsa , divid , slice cheddar chees; latin american
slice bacon , water , egg , allpurpos flour , salt , medium head cabbag , coredsl , minc pickl ginger , tonkatsu saucebarbequ sauc; asian
allpurpos flour , butter , water , almond past , egg , white sugar , almond extract , pinch salt , egg white , beaten; european
toast sesam oil , clove garlic clove , peeledsl , black bean sauc , salt , skinless , boneless chicken breast into cube , cube chicken bouillon dissolv in , boil water , larg onion , peeledsl , bunch green onion , , green bell pepper , dice , dark soy sauc , black pepper , cornstarch dissolv in , water , fresh cilantro; asian
loaf process chees food , cube , contain sour cream , condens cream of chicken soup , fluid evapor milk , ground cumin , chicken chunk , drain , shred cheddar chees , green chile pepper , inch flour tortilla; latin american
packag frozen chees ravioli , cream , shred smoke gouda chees , fresh parsley , white pepper; european
oliv oil , larg onion , slice , stew tomato , tomato past , salt , black pepper , cayenn pepper , red pepper flake , worcestershir sauc , fresh rosemari , water , whole chicken , into piec , uncook white rice , dice carrot , fresh green bean , trimmedsnap into inch piec , ground nutmeg; african
dri rice vermicelli , peanut oil , thinli slice firm tofu , larg egg , beaten , clove garlic , fine , veget broth , fresh lime juic , soy sauc , white sugar , salt , dri red chili flake , peanut , bean sprout , divid , green onion , white thinli acrossgreen slice into thin length divid , peanut , lime , into wedg for garnish; asian
chicken wing , soy sauc , dark soy sauc , sesam oil , oyster sauc , garlic powder , onion powder , ground black peppertast , dri basil; asian
veget oil , divid , chicken thigh , skinnedpat dri , chicken drumstick with skin , pat dri , saltblack peppertast , bunch fresh cilantro , leav pick from stem , clove garlic , peeledcoars , aji peruvian pepper , seededdevein , worcestershir sauc , orang juic , uncook white rice , onion , , white wine , chicken broth , freshli ground black pepper , larg carrot , peeledd , bell pepper , ani color , slice into ring , frozen pea; latin american
veget oil , whole chicken , into piec , fresh spinach , rins , water , larg onion , minc , clove garlic , minc , inch piec fresh ginger root , minc , crush tomato , ground coriand , cayenn pepper , moretast , ground turmer , cardamom pod , whole clove , salt , water , if need , milk , garam masala , sour cream , butter; asian
box penn pasta , hot italian sausag link , into inch piec , clove garlic , minc , crush red pepper flake , broccoli rabe , into inch length , grate parmesan chees , pasta boil water , grate parmesan chees , saltpeppertast; european
ola oil , shallot , fine , clove garlic , slice , fine fresh ginger , green curri past , skinless , boneless chicken breast halv into strip , saltpeppertast , stalk lemon grass , babi corn , drain , water chestnut , drain , coconut milk , bunch fresh thai basil leav , torn; asian
packag cream chees , milk , egg yolk , white sugar , divid , egg white , cream of tartar , allpurpos flour , cornstarch; asian
dri basil , dri oregano , dri rosemari , dri marjoram , dri cilantro , dri thyme , dri savori , red pepper flake; european
packag rigatoni pasta , veget oil , onion , slice , clove garlic , crush , small zucchini , slice , small yellow squash , slice , green bell pepper , slice , packag slice fresh mushroom , crush tomato , dri oregano , dri basil , red pepper flake , salt , ground black pepper , shrimp , peeleddevein; european
skinless , boneless chicken breast halv , slice , veget oil , cornstarch , soy sauc , dri sherri , minc garlic , minc fresh ginger root , soy sauc , dri sherri , oyster sauc , sambal oelek , veget oil , divid , broccoli floret , slice onion , green onion , slice , saltground black peppertast; asian
fresh broccoli floret , water , peanut oil , larg clove garlic , minc , lowsodium chicken broth , soy sauc , oyster sauc , grate fresh ginger root , uncook medium shrimp , peeleddevein , ned water chestnut , drain , cornstarch; asian
rotisseri chicken , skinnedbon , meat pull into larg chunk , minc garlic , minc fresh ginger , packag coleslaw mix with carrot , fresh basil , white sugar , black peppertast , hoisin sauc , soy sauc , white vinegar , head green leaf lettuc , leav separ , rins , pat dri , thaistyl peanut sauc; asian
tilapia fillet , taco season mix , oliv oil , packag taco shell , contain plain yogurt , lime juic , white sugar , grate lime zest , salt , coleslaw mix , fresh cilantro , small jalapeno chile , seed , fine , tomato , seededd; latin american
cook oil , ground ginger , red chile powder , ground cinnamon , ground turmer , ground white pepper , larg onion , , clove garlic , minc , ned tomato , skinless , boneless chicken breast halv cube , chicken stock , ground almond , heavi cream , plain yogurt; asian
ground sausag , packag cream chees , soften , mozzarella chees , shred , jar spaghetti sauc , manicotti shell; european
larg banana , inch squar spring roll wrapper , brown sugar , to tast , quart oil for deep fri; asian
chicken let , ed thin , salt , ground black pepper , allpurpos flour , butter , chicken broth , marsala wine , clove garlic , minc , slice fresh mushroom , small tomato , dice , dri rosemari , dri basil; european
oliv oil , saltground black peppertast , skinless , boneless chicken breast , into cube , onion , dice , slice cremini mushroom , condens cream of mushroom soup , marsala wine; european
confection sugar , shred coconut , cream , ground cinnamon; european
lasagna noodl , onion , red bell pepper , frozen corn kernel , thaw , clove garlic , , black bean , rinseddrain , refri black bean , ned tomato sauc , salsa , fresh cilantro , divid , cottag chees , ricotta chees , sour cream , monterey jack chees , shred , slice ripe oliv , sprig fresh cilantro; latin american
skinless , boneless chicken , taco season mix , dice tomato with habanero such as rotel hot , fine onion , fine celeri , shred carrot , prepar salsa , water; latin american
packag spaghetti , soy sauc , oyster sauc , brown sugar , fish sauc , garlic powder , ground ginger , veget oil , uncook medium shrimp , peeleddevein , broccoli , yellow onion , thinli slice , crimini mushroom , slice , clove garlic , minc , larg egg; asian
water , uncook white rice , oliv oil , yellow onion , thinli slice , salt , plusto tast , tomato past , clove minc garlic , paprika , ground cumin , cayenn peppertast , fullfat coconut milk , soy sauc , redyellow bell pepper , halvedthinli slice , jalapeno pepper , seededthinli slice , green onion , sea bass fillet , into chunk , pinch salt , cilantro leav , freshli squeez lime juic; latin american
ground beef , jar marinara sauc , water , salt , lasagna noodl , packag cottag chees , grate mozzarella chees , grate parmesan chees; european
cabbag leav , ground beef , uncook white rice , tomato sauc , new mexico red chile powder , clove garlic , minc , onion , saltground black peppertast , dice tomato with green chile pepper; latin american
butter , pork tenderloin , medium onion , thinli slice , larg sweet appl peel , coredthinli slice , allpurpos flour , chicken stock , fluid bottl hard appl cider , saltpeppertast , heavi cream; european
packag tofu , plain yogurt , lemon juic , ground cumin , cayenn pepper , paprika , garam masala , minc fresh ginger root , unsalt butter , clove garlic , minc , serrano pepper , seededminc , ground coriand , ground cumin , garam masala , salt , tomato sauc , small head cauliflow , into floret , cream , frozen pea , fresh cilantro; asian
tuna , drain , refri black bean , lowfat sour cream , ned sweet corn , drain , hot buffalo wing sauc , garlic salt , ground cumin , butter , divid option , inch tortilla wholewheat tortilla , shred mexi chees blend , divid; latin american
skinless , boneless chicken breast halv , jerk past , packag uncook egg noodl , oliv oil , clove garlic , minc , chicken stock , jerk past , dri white wine , fresh cilantro , lime , quarter , saltpeppertast , heavi whip cream , sprig fresh cilantro , for garnish; latin american
lightdark brown sugar , ground coriand , ground ginger , turmer , salt , garlic powder , chili powder , prepar thai peanut sauc , light coconut milk , chicken broth , boneless , skinless chicken breast halv , veget oil , coars peanut , thinli slice scallion; asian
long grain rice , rins , quart water , cinnamon stick , broken into piec , vanilla option , white sugar; latin american
whole wheat flour tortilla , slice smoke turkey , into thin strip , avocado peel , pittedsl , sour cream , for top , cheddar chees; latin american
veget oil , beef ribey steak , red bell pepper , , green bell pepper , , onion , slice , clove garlic , minc , fajita season , lime , juic; latin american
allpurpos flour , white sugar , fine ground almond , bake powder , bake soda , lemon zest , poppi seed , egg , egg white , lemon extract; european
ground beef , packet taco season mix , sweet onion , green onion , to tast , , packag cream chees , soften , chunki salsa , corn tortilla , shred pepperjack chees , divid , enchilada sauc , slice black oliv; latin american
hoisin sauc , white wine , soy sauc , white sugar , tomato past , garlic , hot pepper sauc such as tabasco , to tast , babi back rib , into inch riblet; asian
ned coconut milk , ground coriand , yellow curri powder , fish sauc , chili oil , skinless , boneless chicken breast halv into strip , fresh cilantro , unsalt peanut , wooden skewer , soakedwat for minut , prepar thai peanut sauc; asian
skinless halibut fillet , into larg piec , pinch garlic powder , saltground black peppertast , bunch green onion , , green bell pepper , fine , coars fresh cilantro , sour cream , mayonnais , shred cheddar chees , enchilada sauc , flour tortilla , shred cheddar chees , avocado peel , pit , slice; latin american
water , cube chicken bouillon , cornstarch , white sugar , oyster sauc , soy sauc , skinless , boneless chicken breast meat cube , allpurpos flour , egg , milk , salt , ground black pepper , cashew halv , green onion; asian
cook spray , ground beef , saltground black peppertast , wonton wrapper , grate parmesan chees , shred mozzarella chees , ricotta chees , pasta sauc such as muir glen , fresh basil , tooption; european
white sugar , water , ned crush pineappl , drain , coconut milk , lime juic; latin american
oliv oil , beef chuck roast , trim , salt , ground black pepper , larg onion , , dice green chile pepper , bottl hot sauc , taco season , chili powder , cayenn pepper , garlic powder; latin american
lean ground beef , dri bread crumb , packag dri onion soup mix , barbecu sauc , clove garlic , minc , egg , allpurpos flour , ground black peppertast , thin slice deli ham , as need , shred swiss chees , as need , ketchup , mustard , brown sugar , dash soy sauc; european
larg tomato peel , seed , whole chicken , into piec , oliv oil , onion , , stalk celeri , , dri white wine , dri oregano , pinch salt , pinch ground black pepper , balsam vinegar , fresh mushroom , slice; european
veget oil for fri , egg , cornstarch , cornstarch , skinless , boneless chicken thigh , into bites piec , white sugar , distil white vinegar , rice vinegar , dri sherri , soy sauc , minc garlic , veget oil , dri whole red chili , to tast , minc fresh ginger , to tast; asian
packag lasagna noodl , oliv oil , onion , , carrot , fine , stalk celeri , fine , mushroom , , clove garlic , minc , dri white wine , dice tomato with juic , sundri tomato , , dri thyme , salttast , ground black peppertast , allpurpos flour , heavi whip cream , ground nutmeg , pinch salt , spinach , rins , grate parmesan chees; european
dark beer , allpurpos flour , salt , cod fillet , cube , quart veget oil for fri , inch corn tortilla , shred cabbag , mayonnais , salsa , lime , into wedg; latin american
skinless , boneless chicken breast halv into inch cube , peeleddevein larg shrimp per , soy sauc , rice wine , sesam oil , cornstarch , veget oil , divid , clove garlic , minc , dri red chile pepper , , szechuan peppercorn option , red bell pepper , slice , green bell pepper , slice , dark soy sauc , rice wine , white sugar , salt peanut , green onion , into inch length , dash sesam oil , tooption; asian
