stem_ing;continent
corn beef brisket , black peppercorn , garlic powder , onion , peeledleft whole , bay leav , pinch salt , small head cabbag , core into wedg , larg potato , quarter , larg carrot , peeledsl , fresh parsley , butter; european
peanut oil , stalk celeri , , carrot , peeleddiagon slice , skinless , boneless chicken breast halv into strip , cornstarch , orang juic , light soy sauc , honey , minc fresh ginger root , cashew , minc green onion; asian
soy sauc , veget oil , lemon juic , sesam seed , white sugar , green onion , thinli slice , clove garlic , minc , ground ginger , sirloin steak , cube; asian
ground beef , onion , , stalk celeri , , egg noodl , chili , peeledd tomato , whole kernel corn , drain , salsa , packag taco season mix; latin american
mango peel , seededd , plain yogurt , white sugar , ice; asian
veget oil , soy sauc , lemon juic , prepar mustard , worcestershir sauc , clove garlic , minc , coars crack black pepper , salt , lean beef , into inch cube , mushroom cap , metal skewer , as need , green bell pepper , into chunk , red bell pepper , into chunk , larg onion , into larg squar; asian
bacon greas , larg onion , , clove garlic , , salt , crush red pepper flake , paprika , whole chicken , into piec , water , dice tomato , allpurpos flour , contain sour cream; european
egg , vanilla extract , salt , white sugar , allpurpos flour , lemon zest , butter , granul sugar for decor; european
chicken wing , splittip discard , pack brown sugar , clove garlic , minc , minc fresh ginger root , water , honey , reducedsodium soy sauc , cornstarch , water; asian
butter , white sugar , egg , ricotta chees , vanilla extract , allpurpos flour , bake powder , bake soda , milk , butter , shorten , confection sugar , lemon extract , color dy sprinkl; european
thinli slice scotch fillet chuck eye steak , soy sauc , white sugar , sesam seed , sesam oil , shallot , thinli slice , clove garlic , crush , mirin japanes sweet wine; asian
skinless , boneless chicken breast halv , bottl italianstyl salad dress; european
uncook shortgrain white rice , water , coconut milk , white sugar , salt , coconut milk , white sugar , salt , tapioca starch , mango , peeledsl , toast sesam seed; asian
whole chicken , into piec , onion , soy sauc , minc fresh ginger root , minc garlic , honey , green onion; asian
boneless salmon fillet , dri basil , tomato , thinli slice , oliv oil , grate parmesan chees; european
cook chicken meat , sour cream , dice tomato , chili powder , onion , green onion , , tomato , dice , ned tomato sauc , salsa , chili powder , dri oregano , dri parsley , inch flour tortilla , shred cheddar chees , black oliv , drain; latin american
packag uncook pasta shell , oliv oil , onion , , clove garlic , slice , zucchini , , dri oregano , saltfreshli ground black peppertast , crush red pepper flake , chicken broth , cook chicken , dice roast red pepper , light cream chees , fresh basil leav , grate parmesan chees; european
packag egg noodl , stick butter , medium head green cabbag , , saltpeppertast; european
egg white , vanilla extract , pinch salt , unbleach allpurpos flour , white sugar; asian
garbanzo bean , rinseddrain , small onion , fine , clove garlic , minc , fresh cilantro , dri parsley , ground cumin , ground turmer , bake powder , fine dri bread crumb , salt , crack black peppercorn , quart veget oil for fri; european
head broccoli , into floret , whole button mushroom , small zucchini , , carrot , oliv oil , saltpeppertast , water , milk , butter , packag instant mash potato flake , packag corn tortilla , enchilada sauc , shred cheddar chees; latin american
ola oil , chines eggplant , halv lengthwis into inch moon , water , crush red pepper flake , garlic powder , white sugar , cornstarch , light soy sauc , oyster sauc; asian
veget oil , water , shred cabbag , minc garlic , larg fresh shrimp , peeleddevein , crush red pepper flake , slice onion , fresh cilantro , soy sauc; asian
rotini pasta , oliv oil , skinless , boneless chicken breast halv , into bite size piec , clove garlic , minc , salt , garlic powder , dri basil , dri oregano , sundri tomato , grate parmesan chees; european
uncook spaghetti , clove garlic , thinli slice , oliv oil , red pepper flake , to tast , saltfreshli ground black peppertast , fresh italian parsley , fine grate parmigianoreggiano chees; european
cornstarch , salt , black pepper , flank steak , thinli slice , quart oil for fri , soy sauc , rice vinegar , rice wine , honey , granul sugar , chile past , water , fresh ginger root , veget oil , clove garlic , , slice onion , dice red bell pepper; asian
fillet red snapper , oliv oil , lemon , juic , rice wine vinegar , dijon mustard , honey , green onion , ground ginger; asian
allpurpos flour , semolina flour , pinch salt , larg egg , oliv oil; european
skinless , boneless chicken breast halv , jar medium salsa , tomato sauc , clove garlic , minc , small red onion , , ground cumin , chili powder , pinch saltfresh ground peppertast; latin american
eggplant , veget oil , cumin seed , medium onion , slice , fresh ginger , larg tomato peel , seededd , clove garlic , minc , ground turmer , ground cumin , ground coriand , cayenn pepper , salt , to tast , ground black peppertast , fresh cilantro; asian
red lentil , water , salt , ground turmer , chili powder , spinach , rins , butter , onion , , ground cumin , mustard seed , garam masala , coconut milk; asian
crush corn flake , chili powder , packet dri fajita season , red bell pepper , yellow bell pepper , orang bell pepper , fresh mushroom , medium red onion , dice , skinless , boneless chicken breast halv ed thin , shred cheddar chees , divid , salsa , toothpick; latin american
uncook glutin white rice , water , boneless beef sirloin steak inch thick , cornstarch , beef broth , soy sauc , pack brown sugar , garlic powder , fresh broccoli floret; asian
fluid warm water , salt , veget oil , allpurpos flour , activ dri yeast , tomato past , water , packag taco season mix , divid , chili powder , to tast , cayenn pepper , to tast , fatfre refri bean , salsa , onion , ground beef , shred cheddar chees; latin american
soy sauc , red wine vinegar , honey , garlic powder , pork chop; asian
peanut oil , sweet onion , minc , clove garlic , , ground ginger , ground cumin , ground turmer , paprika , red chili powder , tomato , coconut milk , salt , cookedpeel shrimp , fresh cilantro; asian
peeledd pumpkin , eggplant , slice into inch round , tomato , pint ricotta chees , crumbl feta chees , pesto , egg , beaten , saltpeppertast , tomato sauc , fresh pasta sheet , shred mozzarella chees , grate parmesan chees; european
lasagna noodl , oliv oil , ground beef , bulk italian sausag , slice mushroom , drain , garlic salt , dri oregano , dri thyme , dri basil , tomato sauc , saltpeppertast , contain ricotta chees , egg , beaten , grate parmesan chees , shred mozzarella chees; european
fresh lime juic , fluid rum , brown sugar , cayenn pepper , ground clove , ground cinnamon , ground ginger , black pepper , salt , dri thyme leav , whole chicken , veget oil; latin american
uncook spaghetti , veget oil , fresh slice mushroom , shred carrot , slice red bell pepper , onion , , clove garlic , minc , fresh bean sprout , green onion , cornstarch , chicken broth , hoisin sauc , honey , soy sauc , grate fresh ginger , cayenn pepper , curri powder; asian
skinless , boneless chicken breast halv , inch flour tortilla , packag shred monterey jack chees , green enchilada sauc; latin american
packag fresh fettuccin , butter , medium onion , , packag slice mushroom , clove garlic , crush , jar sundri tomato , packedoil , slice black oliv , drain , marin artichok heart , dri white wine , lemon juic , ripe tomato , , parmesan chees , black pepper; european
cornstarch , chicken broth , soy sauc , ground ginger , hot pepper sauc , veget oil , skinless , boneless chicken breast meat into strip , small onion , , green bell pepper , , slice water chestnut , drain , cashew; asian
soy sauc , water , vinegar , honey , minc garlic , bay leav , black pepper , skinless , boneless chicken thigh; asian
ground beef , ground pork , onion , bread crumb , egg , milk , dri parsley , worcestershir sauc , salt , pepper , veget oil , allpurpos flour , paprika , salt , pepper , boil water , sour cream; european
roma plum tomato , extra virgin oliv oil , spanish onion , , clove garlic , , pinch italian season , kalamata oliv , pit , white wine , caper , fresh lemon juic , leav fresh basil , , freshli grate parmesan chees , flounder fillet , leav fresh basil , torn; european
lean ground beef , dice tomato with green chile pepper , drain , water , sour cream , packag taco season mix , shred colbymonterey jack chees , packag corn tortilla chip; latin american
granni smith appl peel , coredsl , sugar , sugar , flour , cinnamon , melt butter , egg; european
medium head shred cabbag , red onion , into strip , butter , packag wide egg noodl , salttast , ground black peppertast; european
beef stock , heavi cream , allpurpos flour , soy sauc , ground black pepper , dri rosemari , packag frozen cook meatbal , thaw; european
medium red potato , cube , butter , melteddivid , skinless , boneless chicken breast halv , fresh lime juic , shred mexi blend chees , fresh cilantro , salsa , lime , into wedg option; latin american
buttermilk , bake soda , white sugar , butter , veget oil , shorten , egg yolk , vanilla extract , egg white , allpurpos flour , packag flake coconut , pe , packag cream chees , soften , margarin , soften , confection sugar , vanilla extract , pe; european
allpurpos flour , curri powder , dash salt , margarin , shorten , water , margarin , ground beef , small onion , fine dice , curri powder , dri thyme , salt , pepper , beef broth , dri bread crumb , egg , beaten; latin american
butter , onion , , condens cream of mushroom soup , condens cream of chicken soup , coconut milk , packet dri onion soup mix such as knorr french onion soup mix , curri powder , to tast , salt , ground black pepper , ground cayenn pepper , to tast , larg skinless , boneless chicken breast halv trim into inch piec , green pea , slice fresh mushroom; asian
dri rice noodl , white sugar , distil white vinegar , fish sauc , tamarind past , veget oil , boneless , skinless chicken breast halv , slice into thin strip , veget oil , garlic , minc , egg , beaten , white sugar , salt , coars ground peanut , bean sprout , fresh chive , paprika , to tast , lime , into wedg; asian
allpurpos flour , salt , pepper , fresh parsley , dri dill weed , butter , divid , boneless , skinless chicken breast halv , fresh mushroom , onion , slice into ring , white wine , gruyer chees , shred; european
packag spinach , shred cheddar chees , butter , clove garlic , slice , portobello mushroom cap , slice , inch flour tortilla , veget oil; latin american
packag linguin pasta , slice bacon , boneless chicken breast , cookedd , salttast , peeledd tomato with juic , dri rosemari , crumbl feta chees , pit black oliv , artichok heart , drain; european
soy sauc , water , white vinegar , dark brown sugar , white sugar , black pepper , sesam oil , minc garlic , larg onion , minc , koreanstyl short rib beef chuck flanken , inch thick across bone; asian
lime , juic , minc garlic , dri oregano , ground cumin , fine ned chipotl peppersadobo sauc , adobo sauc from ned chipotl pepperstast , beef sirloin steak , saltpeppertast; latin american
extra virgin oliv oil , butter , minc garlic , tilapia fillet , saltground black peppertast , slice fresh button mushroom , drain caper , white wine , lemon , juic; european
egg , milk , skinless , boneless chicken breast halv into chunk , plain dri bread crumb , oil for fri , swiss chees , cube , cube ham , condens cream of chicken soup , milk; european
ola oil , minc onion , minc red bell pepper , clove garlic , minc , ground cumin , ground coriand , curri powder , light coconut milk , sugar , crush red pepper flake , jumbo shrimp , peeleddevein , cornstarch , water , fresh cilantro; asian
black bean , rinseddrain , clove garlic , minc , onion , , dice green chile pepper , jalapeno pepper , seededminc , packag tempeh , crumbl , inch corn tortilla , enchilada sauc , slice black oliv , shred cheddar chees; latin american
oliv oil , distil white vinegar , fresh lime juic , packag dri italianstyl salad dress mix , whole boneless , skinless chicken breast , cube , onion , slice , green bell pepper , slice; latin american
packag spaghetti , lowsodium soy sauc , teriyaki sauc , honey , ground ginger , veget oil , stalk celeri , slice , larg carrot , into larg matchstick , sweet onion , thinli slice , green onion , slice; asian
allpurpos flour , ground cumin , cayenn pepper , salt , veget oil , boneless pork chop , about inch thick , chicken broth , coconut milk , peanut butter , honey , ground ginger , salt , green onion , slice red bell pepper , coars dri roast peanut , fresh cilantro; asian
hot salsa , chunki peanut butter , light coconut milk , lime juic , soy sauc , white sugar , grate fresh ginger , skinless chicken thigh , peanut , for top , cilantro , for top; asian
pint ricotta chees , egg , packag frozen spinach , thaweddrain , shred mozzarella chees , grate parmesan chees , white sugar , salt , ground black pepper , manicotti shell , jar spaghetti sauc; european
potato , peel , shred colbymonterey jack chees , chili powder , ground cumin , clove garlic , minc , saltpeppertast , inch flour tortilla , red enchilada sauc; latin american
ground turkey , hot tomato sauc , whole kernel corn , drain , small onion , dice , fatfre refri bean , contain fat free sour cream , shred reducedfat cheddar chees , inch flour tortilla; latin american
italian sausag link , small zucchini , slice , small yellow squash , slice , onion , stew tomato , with liquid; european
veget oil , boneless pork chop , orang juic , soy sauc , white sugar , water , cornstarch; asian
sauerkraut , rinseddrain , caraway seed option , brown sugar , appl , dice , bacon , into inch piec , larg onion , , kielbasa sausag , into inch thick slice; european
oliv oil , skinless , boneless chicken breast halv into inch piec , onion , clove garlic , , dice tomato , fresh broccoli floret , saltpeppertast , pinch dri oregano , dri penn pasta , fresh basil leav , into thin strip , grate parmesan chees; european
veget oil , japanes eggplant , into inch cube , veget oil , onion , thinli slice , minc garlic , soy sauc , water , oyster sauc , chili garlic sauc , white sugar , ground black peppertast , asian toast sesam oil; asian
packag jumbo pasta shell , italian sausag , packag frozen spinach thaw , drainedsqueez dri , ricotta chees , egg , clove garlic , crush , lemon , juic , grate parmesan chees , saltpeppertast , dri oregano , spaghetti sauc , shred mozzarella chees; european
red lentil , slice ginger , inch piec , peel , ground turmer , salt , cayenn pepper , to tast , veget oil , dri minc onion , cumin seed; asian
eggplant , peel lengthwis into inch slice , egg , beaten , italian season bread crumb , oliv oil , ricotta chees , slice prosciutto , jar spaghetti sauc , shred mozzarella chees , angel hair pasta; european
packag jumbo pasta shell , ground beef , egg , lightli beaten , oliv oil , minc garlic , garlic salt , parsley , packag cream chees , at room temperatur , jar pasta sauc , freshli grate romano chees; european
italian sausag , case remov , dice celeri , dice onion , peeledd tomato , tomato sauc , garlic powder , salt , dri oregano , dri ziti pasta , slice mushroom , drain , shred mozzarella chees , grate parmesan chees; european
extra virgin oliv oil , divid , boneless pork chop , ed inch thick , saltpeppertast , clove garlic , thinli slice , larg tomato , dice , chicken broth , dri white wine , minc fresh parsley , red pepper flake; european
oliv oil , larg onion , into ring , stew tomato , chipotl peppersadobo sauc , to tast , shred cook chicken meat , tostada shell , sour cream; latin american
clove garlic , larg onion , quarter , fresh oregano , ground cumin , ground ancho chile pepper , salt , ground black pepper , oliv oil , white wine vinegar , boneless pork loin roast , lime , into wedg; latin american
salmon fillet , lemon , pesto , white wine; european
plain yogurt , garam masala , paprika , freshli ground black pepper , salt , cayenn pepper , ground coriand , skinless , boneless chicken breast into inch strip , veget oil , cumin seed , larg onion , , clove garlic , minc , grate fresh ginger , green chile pepper , minc , roma tomato , dice , tomato past , water , garam masala , ground coriand , ground turmer , heavi whip cream , salt , to tast , bunch cilantro for garnish; asian
packag uncook farfal pasta , oliv oil , clove garlic , crush red pepper flake , lemon juic , pine nut , slice black oliv , sundri tomato , crumbl feta chees , saltpeppertast; european
medium mango , peeledsl , divid , coconut milk , veget oil , spici curri past , skinless , boneless chicken breast halv into cube , medium shallot , slice , larg english cucumb , seededsl; asian
corn beef brisket , pickl spice , larg orang , slicedround , stalk celeri , slice , larg onion , slice , cold water , margarin , divid , larg head cabbag , coredsl , golden delici appl , coredquart with peel , cold water; european
lightli pack brown sugar , soy sauc , sesam oil , oliv oil , rice vinegar , lime juic , minc garlic , minc fresh ginger , sriracha hot pepper sauc , boneless countrystyl pork rib; asian
bonein chicken breast halv , skinless , saltpeppertast , oliv oil , onion , peeledquart , fine fresh ginger root , crush garlic , hot madra curri powder , tomato sauc , coconut milk , whole clove , pod cardamom , cinnamon stick , salttast; asian
packag frozen mix veget , thaw , small potato , peel , packag polish beef sausag , into inch slice , butter , into piec , lemon pepper , shred cheddar chees; european
burgundi wine , brandi , onion , thinli slice , carrot , , sprig fresh parsley , bay leaf , clove garlic , crush , whole black peppercorn , salt , cube beef chuck roast , oliv oil , divid , bacon , cube , onion , , allpurpos flour , tomato past , clove garlic , crush , beef broth , saltpeppertast , butter , fresh mushroom , slice; european
long grain white rice , water , chicken bouillon granul , fresh lime juic , fresh cilantro , salttast; latin american
pork tenderloin , trim of silver skin , saltground black pepper , ketchup , season rice vinegar , pineappl chunk , drain with juic reserv , brown sugar , clove garlic , minc , hot chili sauc such as sriracha , soy sauc , pinch red pepper flake , veget oil , butter , green onion white part onli , green onion top; asian
lean ground beef , packag taco season mix , packag corn chip , shred lettuc , fresh tomato , shred cheddar chees , salsa , sour cream; latin american
marinad , fine fresh cilantro , clove garlic , minc , jalapeno chile pepper , seededminc , fine grate fresh lime zest , salt , onion powder , ground black pepper , chipotl chile powder , oliv oil , chicken breast tenderloinsstrip , salsa , medium tomato , , small sweet onion , fine , fine fresh cilantro , jalapeno chile pepper , seededminc , clove garlic , fine , ground black pepper , sea salt , chipotl chile powder , fresh lime juic , grill veget , sweet onion into inch slice , red bell pepper , quarter , oliv oil , salt , minc garlic , lime mayonnais , mayonnais , fresh lime juic , thick slice french bread , mango peel , seed , slice , slice monterey jack chees; latin american
ground beef , small onion , , clove garlic , minc , taco season mix , moretast , dri oregano , sour cream , green chili , distil white vinegar , shred cheddar chees , margarin , inch corn tortilla; latin american
cornstarch , water , lowsodium soy sauc , white sugar , mirin japanes sweet wine , grate fresh ginger , clove garlic , minc , red pepper flake , skinless , boneless chicken breast halv; asian
lasagna noodl , oliv oil , head fresh broccoli , , carrot , thinli slice , larg onion , , green bell pepper , , small zucchini , slice , clove garlic , minc , allpurpos flour , milk , parmesan chees , divid , salt , pepper , packag frozen spinach , thaw , contain small curd cottag chees , ricotta chees , shred mozzarella chees , divid; european
butter , extravirgin oliv oil , zucchini , into noodleshap strand , larg yellow onion , minc , garlic , kosher salt , butter , larg shrimp , peeleddevein , minc garlic , bag babi spinach , fresh lemon juic , red pepper flake , kosher salt , freshli ground black pepper; european
veget oil , clove garlic , fine , packag uncook linguin pasta , salttast , broccoli , cabbag , shred carrot , cauliflow , dice green onion , chicken tender , into bites piec , soy sauc , saltpeppertast , cilantro , lime wedg; european
bulk italian sausag , lean ground beef , packag fresh mushroom , coars , salt , freshli ground black pepper , dri italian herb season option , red pepper flake , prepar marinara sauc , water , plusa need , egg , wholemilk ricotta chees , contain fresh mozzarella chees , dice , freshli shred parmigianoreggiano chees , salt , freshli ground black pepper , pinch cayenn pepper , to tast , fresh parsley , packag lasagna noodl , contain fresh mozzarella chees , dice , freshli shred parmigianoreggiano chees; european
fresh poblano chile pepper , monterey jack chees , shred , mild cheddar chees , shred , dice cook chicken , allpurpos flour , evapor milk , sour cream , egg , salsa; latin american
ground beef , sweet corn , drain , mild , chunki salsa , slice black oliv , cook egg noodl , kidney bean , drainedrins , taco sauc , packag taco season mix , tomato sauc; latin american
ground chicken , egg , bread crumb , salsa , ranchstyl salad dress , packag taco season mix , shred cheddar chees , sour cream option; latin american
cake flour , bake soda , salt , egg , separ , white sugar , divid , butter , soften , grate lemon zest , lemon juic , plain wholemilk yogurt; european
veget oil , packag frozen stirfri veget , minc fresh ginger , saltpeppertast , egg , beaten , cornstarch , saltpeppertast , packag firm tofu , drainedcub , veget oil , peanut sauc , peanut; asian
butter , white sugar , egg , anis extract , vanilla extract , allpurpos flour , salt , bake powder , almond; european
sweet potato , packag cream chees , soften , green onion , , chili powder , ground cumin option , dri oregano , salt , ground black pepper , veget oil for fri , inch corn tortilla , enchilada sauc , packag shred monterey jack chees; latin american
eggplant , peel into inch slice , salt , as need , italianstyl bread crumb , grate parmesan chees , egg , beaten , jar garlidtomato pasta sauc , grate parmesan chees , packag shred mozzarella chees , as need , dri basil; european
avocado peel , pit , mash , onion , dice , garlic salt , inch corn tortilla , bunch fresh cilantro leav , fine , jalapeno pepper sauc , tast; latin american
soy sauc , brown sugar , lime juic , orang juic , thaistyl sweet chili sauc , chilegarl sauc such as sriracha , clove garlic , minc , curri powder , skinless , boneless chicken thigh; asian
tilapia fillet , lime juic , salt , ground black pepper , garlic powder , paprika , cook spray , plain fatfre yogurt , lime juic , fresh cilantro , ned chipotl peppersadobo sauc , inch corn tortilla , shred cabbag , shred monterey jack chees , tomato , , avocado peel , pit , slice , salsa , green onion ,; latin american
clove garlic , minc , pit prune , halv , small green oliv , caper , with liquid , oliv oil , red wine vinegar , bay leav , dri oregano , saltpeppertast , whole chicken , skin remov into piec , pack brown sugar , dri white wine , fresh parsley , for garnish; european
packag refriger chees tortellini , butter , small onion , , packag cream chees , grate parmesan chees , milk , fresh mushroom , slice , packag frozen spinach , thaweddrain , cherri tomato , halv; european
boneless beef top sirloin , into thin bites slice , salt , freshli ground black pepper , crush red peppertast , lime , tomatillo , fresh jalapeno pepper , seed , ola oil , divid , beef broth , inch corn tortilla , larg onion , , tomato , , avocado peel , pittedsl , bunch fresh cilantro , , lemon; latin american
packag lasagna noodl , oliv oil , onion , , slice mushroom , minc garlic , zucchini , fine , crush tomato , tomato past , dri oregano , pinch brown sugar , salttast , packag frozen spinach , thaw , contain nonfat cottag chees , egg , dri basil , divid , grate parmesan chees , shred mozzarella chees; european
flounder fillet , butter , saltpeppertast , lemon juic , dice fresh tomato , dri basil , garlic powder; european
butter , soften , cream chees , soften , allpurpos flour , strawberri jam , sift confection sugar; european
veal shank , into short length , allpurpos flour , butter , clove garlic , crush , larg onion , , larg carrot , , dri white wine , beef stock , dice tomato , saltpeppertast , gremolata , fresh flat leaf parsley , clove garlic , minc , grate lemon zest; european
butter , sugar , egg , allpurpos flour , ground cardamom , ground cinnamon , to tast; european
sesam seed , dri soba noodl , balsam vinegar , white sugar , soy sauc , clove garlic , minc , dark sesam oil , green onion , , broccoli floret; asian
egg , beaten , thinli slice celeri , fine onion , bean sprout , dice fresh mushroom , cook chicken breast , cookedcrumbl ground beef , cook pork , salt , ground black pepper , foo yung sauc , cube chicken bouillon , hot water , white sugar , soy sauc , cold water , cornstarch; asian
lean ground beef , italian season bread crumb , small onion , , salt , shred mozzarella chees , divid , crack black pepper , garlic powder , marinara sauc , hoagi roll , split lengthwis; european
