stem_ing;continent
sweet italian sausag , lean ground beef , minc onion , clove garlic , crush , crush tomato , tomato past , ned tomato sauc , water , white sugar , dri basil leav , fennel seed , italian season , salt , ground black pepper , fresh parsley , lasagna noodl , ricotta chees , egg , salt , mozzarella chees , slice , grate parmesan chees; european
grapese oil , onion , , curri powder , minc fresh ginger root , cayenn pepper , packag frozen butternut squash , coconut milk , peanut butter , salt , moretast , freshli ground black pepper , moretast , fresh cilantro , to tast; asian
skinless , boneless chicken breast halv , saltfreshli ground black peppertast , egg , panko bread crumb , more as need , grate parmesan chees , allpurpos flour , more if need , oliv oil for fri , prepar tomato sauc , fresh mozzarella , into small cube , fresh basil , grate provolon chees , grate parmesan chees , oliv oil; european
skinless , boneless chicken breast halv , slice swiss chees , slice ham , allpurpos flour , paprika , butter , dri white wine , chicken bouillon granul , cornstarch , heavi whip cream; european
chili powder , garlic powder , onion powder , crush red pepper flake , dri oregano , paprika , ground cumin , sea salt , black pepper; latin american
skinless , boneless chicken breast halv , taco season mix , salsa , shred cheddar chees , sour cream option; latin american
allpurpos flour for coat , salt , ground black pepper , dri oregano , skinless , boneless chicken breast halv ed inch thick , butter , oliv oil , slice mushroom , marsala wine , cook sherri; european
ground beef , onion , , minc garlic , black oliv , slice , dice green chili pepper , dice tomato with green chile pepper , jar taco sauc , refri bean , inch flour tortilla , shred colbi chees; latin american
butter , green onion , garlic powder , dice green chile , condens cream of mushroom soup , sour cream , cube cook chicken breast meat , shred cheddar chees , divid , inch flour tortilla , milk; latin american
boneless skinless chicken breast , into inch chunk , saltpepp , to tast , veget oil , curri powder , onion , thinli slice , clove garlic , crush , coconut milk , stew , dice tomato , tomato sauc , sugar; asian
packag bow tie pasta , oliv oil , sweet italian sausag , case removedcrumbl , red pepper flake , dice onion , clove garlic , minc , italianstyl plum tomato , drainedcoars , heavi cream , salt , minc fresh parsley; european
eggplant , peeledthinli slice , egg , beaten , italian season bread crumb , spaghetti sauc , divid , packag mozzarella chees , shreddeddivid , grate parmesan chees , divid , dri basil; european
whole chicken , giblet remov , saltblack peppertast , onion powder , to tast , margarin , divid , stalk celeri , leav remov; european
butter , clove garlic , minc , dri bread crumb , freshli grate parmesan chees , shred cheddar chees , dri parsley , dri oregano , ground black pepper , salt , skinless , boneless chicken breast halv ed thin; european
skinless , boneless chicken breast halv , onion , , pint sour cream , shred cheddar chees , dri parsley , dri oregano , ground black pepper , salt option , tomato sauc , water , chili powder , green bell pepper , clove garlic , minc , inch flour tortilla , jar taco sauc , shred cheddar chees; latin american
water , ketchup , soy sauc , cornstarch , honey , crush red pepper , ground ginger , veget oil , slice green onion , clove garlic , minc , cook shrimp , tail remov; asian
yogurt , lemon juic , fresh ground cumin , ground cinnamon , cayenn pepper , freshli ground black pepper , minc fresh ginger , salt , to tast , boneless skinless chicken breast , into bites piec , long skewer , butter , clove garlic , minc , jalapeno pepper , fine , ground cumin , paprika , salt , to tast , tomato sauc , heavi cream , fresh cilantro; asian
veget oil , onion , , clove garlic , minc , ned kidney bean , drain , water , chili powder , prepar mustard , ground cumin , pinch cayenn pepper , to tast , soy sauc , mash cook sweet potato , inch flour tortilla , warm , shred cheddar chees; latin american
skinless , boneless chicken breast meat into chunk , condens cream of chicken soup , sour cream , chili powder , butter , small onion , , green chili , drain , packag mild taco season mix , bunch green onion , , divid , water , lime juic , onion powder , garlic powder , inch flour tortilla , cheddar chees , shred , divid , enchilada sauc , slice black oliv; latin american
lean ground beef , onion , , clove garlic , minc , fresh basil , dri oregano , brown sugar , salt , dice tomato , tomato past , dri lasagna noodl , egg , beaten , pint partskim ricotta chees , grate parmesan chees , dri parsley , salt , mozzarella chees , shred , grate parmesan chees; european
skinless , boneless chicken breast meat cube , red wine vinegar , lime , juic , white sugar , salt , ground black pepper , green onion , , clove garlic , minc , dri oregano , inch flour tortilla , tomato , dice , shred lettuc , shred monterey jack chees , salsa; latin american
allpurpos flour , cornstarch , bake powder , salt , egg , beer , plain yogurt , mayonnais , lime , juic , jalapeno pepper , minc , minc caper , dri oregano , ground cumin , dri dill weed , ground cayenn pepper , quart oil for fri , cod fillet , into portion , packag corn tortilla , medium head cabbag , fine shred; latin american
butter , clove garlic , minc , sundri tomato , , chicken broth , divid , heavi cream , skinless , boneless chicken breast halv , saltpeppertast , veget oil , fresh basil , dri fettuccini pasta; european
beef chuck roast , salt , ground black pepper , butter , green onion , slice white part onli , allpurpos flour , condens beef broth , prepar mustard , slice mushroom , drain , sour cream , white wine , salttast , ground black peppertast; european
water , salt , ground black pepper , dri oregano , dri basil , onion salt , dri parsley , garlic powder , bay leaf , packag dri italianstyl salad dress mix , rump roast; european
skinless , boneless chicken breast halv , salt , ground black pepper , slice swiss chees , slice cook ham , season bread crumb; european
steak season rub , balsam vinegar , oliv oil , boneless pork loin roast; european
lasagna noodl , butter , onion , , clove garlic , minc , allpurpos flour , salt , chicken broth , milk , shred mozzarella chees , divid , grate parmesan chees , divid , dri basil , dri oregano , ground black pepper , ricotta chees , cube , cook chicken meat , packag frozen spinach , thaweddrain , fresh parsley , grate parmesan chees for top; european
egg , lightli beaten , milk , italian season bread crumb , grate parmesan chees , dri parsley , oliv oil , clove garlic , peel , pork chop; european
packag cream chees , soften , white sugar , mexi vanilla extract , refriger crescent roll , white sugar , ground cinnamon , butter , room temperatur , honey; latin american
packag phyllo dough , nut , butter , ground cinnamon , water , white sugar , vanilla extract , honey; european
lean ground beef , salsa , chili bean , drain , tortilla chip , crush , sour cream , slice black oliv , drain , green onion , fresh tomato , shred cheddar chees; latin american
inch flour tortilla , veget oil , small onion , , red bell pepper , , minc garlic , black bean , rinseddrain , minc jalapeno pepper , cream chees , salt , fresh cilantro; latin american
packag chees tortellini , dice tomato with garliconion , fresh spinach , salt , pepper , dri basil , minc garlic , allpurpos flour , milk , heavi cream , grate parmesan chees; european
penn pasta , butter , extravirgin oliv oil , onion , dice , clove garlic , minc , red bell pepper , dice , portobello mushroom , dice , medium shrimp , peeleddevein , jar alfredo sauc , grate romano chees , cream , cayenn pepper , moretast , saltpeppertast , parsley; european
oliv oil , clove garlic , crushedfin , crush red pepper flake , to tast , skinless , boneless chicken breast halv , prepar marinara sauc , fresh basil , packag shred mozzarella chees , divid , grate parmesan chees , divid , packag garlic crouton; european
sauc , water , orang juic , lemon juic , rice vinegar , soy sauc , grate orang zest , pack brown sugar , minc fresh ginger root , minc garlic , green onion , red pepper flake , cornstarch , water , chicken , boneless , skinless chicken breast , into inch piec , allpurpos flour , salt , pepper , oliv oil; asian
oliv oil , clove garlic , fine , skinless , boneless chicken breast halv into strip , fresh spinach leav , packag dri alfredo sauc mix , pesto , packag dri penn pasta , grate romano chees; european
skinless , boneless chicken breast halv into cube , butter , divid , clove garlic , minc , divid , italian season , fettuccini pasta , onion , dice , packag slice mushroom , allpurpos flour , salt , ground white pepper , milk , and , grate parmesan chees , shred colbymonterey jack chees , roma plum tomato , dice , sour cream; european
salt , garlic powder , ground cumin , crumbl dri oregano , ground coriand , ground cinnamon , boneless pork shoulder roast , bay leav , chicken broth; latin american
oliv oil , fine onion , black bean , drainedrins , whole kernel corn , drain , brown sugar , salsa , red pepper flake , butter , divid , inch flour tortilla , shred monterey jack chees , divid; latin american
cake , packag moist white cake mix , instant coffe powder , coffe , coffe flavor liqueur , fill , contain mascarpon chees , confection sugar , coffe flavor liqueur , frost , heavi cream , confection sugar , coffe flavor liqueur , garnish , unsweeten cocoa powder , squar semisweet chocol; european
cook spray , uncook lasagna noodl , onion , , clove garlic , , veget broth , fresh rosemari , marin artichok heart , drain , packag frozen spinach , thaw , drainedsqueez dri , jar tomato pasta sauc , shred mozzarella chees , divid , packag herbgarl feta , crumbl; european
egg , beaten , dri bread crumb , skinless , boneless chicken breast halv , jar spaghetti sauc , shred mozzarella chees , grate parmesan chees; european
jar salsa , packag dri taco season mix , lime , juic , fresh cilantro , skinless , boneless chicken breast halv; latin american
brandi , lemon juic , frozen lemonad concentr , orang juic , millilit bottl dri red wine , tripl sec , lemon , slice into round , orang , slice into round , lime , slice into round , white sugar option , maraschino cherri , carbon water option; european
ghee clarifi butter , onion , fine , clove garlic , minc , ground cumin , salt , ground ginger , cayenn pepper , ground cinnamon , ground turmer , tomato sauc , heavi whip cream , paprika , white sugar , veget oil , skinless , boneless chicken breast halv , into bites piec , curri powder , salt , tooption , white sugar , tooption; asian
uncook white rice , water , skinless , boneless chicken breast halv , shred monterey jack chees , shred cheddar chees , condens cream of chicken soup , condens cream of mushroom soup , onion , , mild salsa; latin american
veget oil , soy sauc , red wine vinegar , fresh lemon juic , worcestershir sauc , dijon mustard , clove garlic , minc , ground black pepper , flank steak; latin american
link sweet italian sausag , butter , yellow onion , slice , red onion , slice , clove garlic , minc , larg red bell pepper , slice , green bell pepper , slice , dri basil , dri oregano , white wine; european
veget oil , skinless , boneless chicken breast halv boiledshred , onion , green chile pepper , packag taco season mix , sour cream , cottag chees , salt , pinch ground black pepper , inch corn tortilla , shred monterey jack chees , red enchilada sauc; latin american
allpurpos flour , bake powder , unsalt butter , white sugar , egg , vanilla extract , whole milk , sweeten condens milk , fluid evapor milk , heavi whip cream , white sugar , vanilla extract; latin american
packag linguin pasta , red onion , oliv oil , clove garlic , crush , skinless , boneless chicken breast meat into bites piec , marin artichok heart , drain , larg tomato , , crumbl feta chees , fresh parsley , lemon juic , dri oregano , saltpeppertast , lemon , wedg , for garnish; european
veget oil , small onion , dice , minc fresh ginger root , clove garlic , minc , potato , cube , carrot , cube , fresh jalapeno pepper , seededsl , ground unsalt cashew , tomato sauc , salt , curri powder , frozen green pea , green bell pepper , , red bell pepper , , heavi cream , bunch fresh cilantro for garnish; asian
lean ground beef , onion , , tomato past , crush tomato , water , dri oregano , garlic powder , salt , ground black pepper , white sugar , cottag chees , grate parmesan chees , egg , lasagna noodl , shred mozzarella chees; european
plain bread crumb , milk , oliv oil , onion , dice , ground beef , ground pork , egg , bunch fresh parsley , , clove garlic , crush , salt , ground black pepper , red pepper flake , dri italian herb season , grate parmesan chees; european
larg skinless , boneless chicken breast halv into inch medallion , saltpeppertast , allpurpos flour , veget oil , as need , clove garlic , minc , low sodium chicken broth , lemon , thinli slice , fresh lemon juic , caper , drainedrins , butter , minc italian flatleaf parsley; european
egg , veget oil , white sugar , ground cinnamon , salt , vanilla extract , allpurpos flour , bake soda , appl peel , coredd; european
ground beef , ground veal , ground pork , clove garlic , minc , egg , freshli grate romano chees , italian flat leaf parsley , saltground black peppertast , stale italian bread , crumbl , lukewarm water , oliv oil; european
skinless , boneless chicken breast halv into chunk , white wine , soy sauc , sesam oil , divid , cornstarch , dissolv water , hot chile past , distil white vinegar , brown sugar , green onion , , garlic , water chestnut , peanut; asian
condens cream of chicken soup , sour cream , margarin , onion , , chili powder , cook chicken breast , green chile pepper , drain , inch flour tortilla , shred cheddar chees; latin american
water , uncook white rice , cabbag leav , lean ground beef , onion , egg , slightli beaten , salt , ground black pepper , condens tomato soup; european
linguin pasta , butter , heavi cream , ground black pepper , grate parmesan chees , pesto , larg shrimp , peeleddevein; european
butter , slice green onion , clove garlic , minc , packag frozen spinach , thaw , drainedsqueez dri , ricotta chees , sour cream , shred monterey jack chees , inch corn tortilla , enchilada sauc; latin american
oliv oil , small onion , , clove garlic , minc , curri powder , ground cinnamon , paprika , bay leaf , grate fresh ginger root , white sugar , salttast , skinless , boneless chicken breast halv into bites piec , tomato past , plain yogurt , coconut milk , lemon , juic , cayenn pepper; asian
soy sauc , rice wine , brown sugar , cornstarch , veget oil , minc fresh ginger root , minc garlic , beef round steak , into thin strip , snow pea; asian
butter , vanilla extract , confection sugar , allpurpos flour , walnut , confection sugar for decor; european
red lentil , larg onion , dice , veget oil , curri past , curri powder , ground turmer , ground cumin , chili powder , salt , white sugar , minc garlic , minc fresh ginger , tomato pure; asian
ground beef , onion , clove garlic , minc , cumin , salt , pepper , dice green chile pepper , refri bean , chili without bean , condens tomato soup , enchilada sauc , inch flour tortilla , warm , shred lettuc , tomato , shred mexi blend chees , green onion; latin american
peanut oil , shallot , fine , white onion , , butter , lemon juic , ginger garlic past , garam masala , chili powder , ground cumin , bay leaf , plain yogurt , and , tomato pure , cayenn pepper , to tast , pinch salt , pinch black pepper , peanut oil , boneless , skinless chicken thigh , into bites piec , garam masala , pinch cayenn pepper , cornstarch , water; asian
onion powder , garlic powder , chipotl chile powder , salt , brown sugar , pork tenderloin; latin american
skinless , boneless chicken breast halv , cayenn pepper , to tast , saltground black peppertast , allpurpos flour for dredg , oliv oil , caper , drain , white wine , fresh lemon juic , water , cold unsalt butter , inch slice , fresh italian parsley ,; european
worcestershir sauc , cider vinegar , soy sauc , chili powder , clove garlic , minc , dash hot pepper sauc , boneless , skinless chicken thigh , into strip , veget oil , onion , thinli slice , green bell pepper , slice , lemon , juic; latin american
chuck roast , salt , ground black pepper , oliv oil , larg onion , , dice green chile pepper , chili powder , ground cayenn pepper , bottl hot pepper sauc , garlic powder; latin american
season bread crumb , grate parmesan chees , dri oregano , divid , salttast , ground black peppertast , packag firm tofu , oliv oil , tomato sauc , dri basil , clove garlic , minc , shred mozzarella chees; european
lean ground beef , onion , dice green bell pepper , whole kernel corn , taco sauc , chili powder , garlic salt , ground cumin , refri bean , inch flour tortilla , packag shred monterey jack chees , butter , melt , shred lettuc , tomato , dice; latin american
dri ziti pasta , oliv oil , onion , slice , minc fresh rosemari , clove garlic , , ground beef , ground pork sausag , jar spaghetti sauc , salttast , packag provolon chees , slice , sour cream , cottag chees , packag mozzarella chees , shred , freshli grate parmesan chees; european
flank steak , white vinegar , soy sauc , clove garlic , minc , lime , juic , oliv oil , salt , ground black pepper , ground white pepper , garlic powder , chili powder , dri oregano , ground cumin , paprika , white onion , , fresh cilantro , lime , juic , larg tomato , , jalapeno pepper , , white onion , quarter , clove garlic , peel , dri new mexico chile pod , pinch saltpeppertast , packag corn tortilla , grate cotija chees option , lime , into wedg; latin american
pineappl chunk , drain juic reserv , cornstarch , water , divid , white sugar , distil white vinegar , drop orang food color , skinless , boneless chicken breast halv into inch cube , selfris flour , veget oil , cornstarch , salt , ground white pepper , egg , water , quart veget oil for fri , green bell pepper , into inch piec; asian
fluid frozen limead concentr , fluid tequila , fluid water , fluid beer , ice , lime , into wedg; latin american
packag cream chees , salsa , cook chicken breast meat , pinto bean , drain , inch flour tortilla , shred colbyjack chees; latin american
corn beef brisket , brown sugar , fluid bottl irish stout beer eg guin; european
oliv oil , divid , clove garlic , slice , red pepper flake , dice tomato with garlicol oil , tomato sauc , bunch fresh basil , , packag dri penn pasta , egg , bread crumb , garlic powder , salt , pepper , thin chicken breast let; european
packag angel hair pasta , oliv oil , onion , , clove garlic , minc , roma plum tomato , dice , balsam vinegar , lowsodium chicken broth , crush red peppertast , freshli ground black peppertast , fresh basil , grate parmesan chees; european
mayonnais , grate parmesan chees , garlic powder , italian season bread crumb , skinless , boneless chicken breast halv; european
oliv oil , italian sausag link , into inch piec , oliv oil , larg potato , peeledthickli slice , larg green bell pepper , seed into wedg , larg red bell pepper , seed into wedg , larg onion , into wedg , white wine , chicken stock , italian season , saltpeppertast; european
bittersweet chocol , , heavi cream , dark rum option; european
ground beef , bread crumb , dri italian season , clove garlic , minc , fresh parsley , grate parmesan chees , egg , beaten , french baguett , extravirgin oliv oil , garlic powder , pinch salt , to tast , jar spaghetti sauc , slice provolon chees; european
butter , divid , onion , minc , minc garlic , tomato sauc , heavi cream , salt , cayenn pepper , garam masala , skinless , boneless chicken breast , into bites chunk , veget oil , tandoori masala; asian
marinad , extra virgin oliv oil , distil white vinegar , fresh lime juic , lime zest , honey , clove garlic , minc , cumin , chili powder , seafood season , such as old bay , ground black pepper , hot pepper sauc , to tast , tilapia fillet , into chunk , dress , contain light sour cream , adobo sauc from chipotl pepper , fresh lime juic , lime zest , cumin , chili powder , seafood season , such as old bay , saltpeppertast , top , packag tortilla , ripe tomato , seededd , bunch cilantro , , small head cabbag , coredshred , lime , wedg; latin american
skinless , boneless chicken breast , dice , packet fajita season , veget oil , green bell pepper , , red bell pepper , , onion , , inch flour tortilla , packag shred cheddar chees , bacon bit , packag shred monterey jack chees; latin american
packag penn pasta , oliv oil , divid , slice bacon , , minc garlic , dice tomato , bunch fresh spinach , rinsedtorn into bites piec; european
veget oil for fri , egg , boneless , skinless chicken thigh , into inch cube , salt , white sugar , pinch white pepper , cornstarch , veget oil , green onion , clove garlic , minc , dri whole red chili , strip orang zest , white sugar , ground ginger , chicken broth , rice vinegar , soy sauc , sesam oil , peanut oil , cornstarch , water; asian
allpurpos flour , beef broth , white sugar , soy sauc , boneless round steak , into bite size piec , fresh ginger root , clove garlic , minc , fresh broccoli; asian
veget oil , cube skinless , boneless chicken breast meat , packag taco season mix , black bean , rinseddrain , sweet corn , drain , salsa , water as need , shred mexityl chees , crush plain tortilla chip; latin american
white rice , water , soy sauc , brown sugar , cornstarch , minc fresh ginger , minc garlic , red pepper flake , skinless , boneless chicken breast halv , thinli slice , sesam oil , green bell pepper , into matchstick , slice water chestnut , drain , head broccoli , broken into floret , slice carrot , onion , into larg chunk , sesam oil; asian
warm water , pack brown sugar , orang juic , soy sauc , ketchup , white vinegar , clove garlic , minc , crush red pepper flake , chines fivespic powder , grate orang peel , oliv oil , skinless , boneless chicken breast halv , cube , water , uncook white rice , cornstarch , cold water , green onion for garnish; asian
lemon , juic , oliv oil , soy sauc , dri oregano , clove garlic , crush , pork tenderloin , into inch cube , medium yellow onion , into inch piec , green bell pepper , into inch piec , skewer; european
pork butt , into inch cube , salt , white sugar , soy sauc , egg white , green onion , , quart veget oil for fri , cornstarch , veget oil , stalk celeri , into inch piec , medium green bell pepper , into inch piec , medium onion , into wedg , white sugartast , salttast , water , salt , white sugar , appl cider vinegar , ketchup , soy sauc , pineappl chunk , undrain , cornstarch , water; asian
lean ground beef , small onion , , packag dri enchilada sauc mix , inch flour tortilla , shred cheddar chees , slice black oliv , drain; latin american
cod , salsa , shred sharp cheddar chees , coars crush corn chip , avocado peel , pittedsl , sour cream; latin american
lean ground beef , packag cream chees , salt , chili powder , jumbo pasta shell , butter , melt , taco sauc , shred cheddar chees , shred monterey jack chees , crush tortilla chip , sour cream; european
soy sauc , brown sugar , water , clove garlic , minc , onion , , grate fresh ginger root , ground black pepper , dri oregano , crush red pepper flake option , ground cayenn pepper option , ground paprika option , skinless chicken thigh; asian
beef top sirloin , thinli slice , white sugar , rice wine vinegar , frozen orang juic concentr , salt , soy sauc , long grain rice , water , cornstarch , orang zest , grate fresh ginger , minc garlic , broccoli floret , lightli steamedblanch , oil for fri; asian
skinless , boneless chicken breast halv , garlic salttast , inch corn tortilla , torn , green chile enchilada sauc , packag shred monterey jack chees , contain reduc fat sour cream; latin american
veget oil , white sugar , allpurpos flour , egg , bake powder , anis extract , drop anis oil; european
oyster sauc , asian toast sesam oil , sherri , soy sauc , white sugar , cornstarch , beef round steak , into inch thick strip , veget oil , plusif need , thin slice of fresh ginger root , clove garlic , peeledsmash , broccoli , into floret; asian
pico de gallo , tomato , dice , onion , fine , lime , juic , fresh cilantro , jalapeno pepper , seededminc , saltpeppertast , oliv oil , divid , skinless , boneless chicken breast halv into strip , onion , thinli slice , green bell pepper , thinli slice , clove garlic , minc , inch flour tortilla , shred monterey jack chees , sour cream , for top; latin american
white sugar , egg , sweeten condens milk , fluid evapor milk , vanilla extract; european
potato , peeledcub , veget oil , yellow onion , dice , clove garlic , minc , ground cumin , cayenn pepper , curri powder , garam masala , inch piec fresh ginger root , peeledminc , salt , dice tomato , garbanzo bean chickpea , rinseddrain , pea , drain , coconut milk; asian
tub sundri tomato pesto , inch whole wheat pita bread , roma plum tomato , , bunch spinach , rins , fresh mushroom , slice , crumbl feta chees , grate parmesan chees , oliv oil , ground black peppertast; european
round steak , soy sauc , white sugar , veget oil , clove garlic , minc , green onion , , sesam seed; asian
packag bow tie pasta , oliv oil , clove garlic , minc , boneless skinless chicken breast , into bites piec , crush red pepper flakestast , oilpack sundri tomato , drain into strip , pesto sauc; european
packag jumbo pasta shell , larg curd cottag chees , mozzarella chees , shred , grate parmesan chees , egg , lightli beaten , pinch garlic powder , dri oregano , dri parsley , jar spaghetti sauc , grate parmesan chees; european
